{
  "created_at": "2019-01-01 00:00:00.000Z",
  "id": "example string",
  "line_items": [
    {
      "discounted_price": "example string",
      "discounted_price_set": {
        "presentment_money": {
          "amount": "example string",
          "currency_code": "example string"
        },
        "shop_money": {
          "amount": "example string",
          "currency_code": "example string"
        }
      },
      "discounts": [],
      "gift_card": false,
      "grams": 123,
      "id": 123,
      "key": "example string",
      "line_price": "example string",
      "line_price_set": {
        "presentment_money": {
          "amount": "example string",
          "currency_code": "example string"
        },
        "shop_money": {
          "amount": "example string",
          "currency_code": "example string"
        }
      },
      "original_line_price": "example string",
      "original_line_price_set": {
        "presentment_money": {
          "amount": "example string",
          "currency_code": "example string"
        },
        "shop_money": {
          "amount": "example string",
          "currency_code": "example string"
        }
      },
      "original_price": "example string",
      "price": "example string",
      "price_set": {
        "presentment_money": {
          "amount": "example string",
          "currency_code": "example string"
        },
        "shop_money": {
          "amount": "example string",
          "currency_code": "example string"
        }
      },
      "product_id": 123,
      "properties": null,
      "quantity": 123,
      "sku": "example string",
      "taxable": true,
      "title": "example string",
      "total_discount": "example string",
      "total_discount_set": {
        "presentment_money": {
          "amount": "example string",
          "currency_code": "example string"
        },
        "shop_money": {
          "amount": "example string",
          "currency_code": "example string"
        }
      },
      "variant_id": 123,
      "vendor": "example string"
    },
    {
      "discounted_price": "example string",
      "discounted_price_set": {
        "presentment_money": {
          "amount": "example string",
          "currency_code": "example string"
        },
        "shop_money": {
          "amount": "example string",
          "currency_code": "example string"
        }
      },
      "discounts": [],
      "gift_card": false,
      "grams": 123,
      "id": 123,
      "key": "example string",
      "line_price": "example string",
      "line_price_set": {
        "presentment_money": {
          "amount": "example string",
          "currency_code": "example string"
        },
        "shop_money": {
          "amount": "example string",
          "currency_code": "example string"
        }
      },
      "original_line_price": "example string",
      "original_line_price_set": {
        "presentment_money": {
          "amount": "example string",
          "currency_code": "example string"
        },
        "shop_money": {
          "amount": "example string",
          "currency_code": "example string"
        }
      },
      "original_price": "example string",
      "price": "example string",
      "price_set": {
        "presentment_money": {
          "amount": "example string",
          "currency_code": "example string"
        },
        "shop_money": {
          "amount": "example string",
          "currency_code": "example string"
        }
      },
      "product_id": 123,
      "properties": null,
      "quantity": 123,
      "sku": "example string",
      "taxable": true,
      "title": "example string",
      "total_discount": "example string",
      "total_discount_set": {
        "presentment_money": {
          "amount": "example string",
          "currency_code": "example string"
        },
        "shop_money": {
          "amount": "example string",
          "currency_code": "example string"
        }
      },
      "variant_id": 123,
      "vendor": "example string"
    }
  ],
  "note": "example string",
  "token": "example string",
  "updated_at": "2019-01-01 00:00:00.000Z"
}
